{
  "schema": "lobster-buffet.local-adapter-fixture.v0.1.0",
  "fixture_id": "synthetic-project-inspect-adapter",
  "adapter_api": "lobster-buffet.local-adapter.v0",
  "capabilities": [
    {
      "name": "project.resolve",
      "envelope": {
        "ok": true,
        "capability": "project.resolve",
        "result": {
          "project_ref": "opaque-project-lobster-buffet",
          "project_name": "lobster-buffet",
          "kind": "software",
          "lifecycle_state": "active",
          "privacy": "public-candidate"
        },
        "warnings": [],
        "private_data": {
          "contains_private_values": false,
          "private_refs_only": true,
          "disclosure_policy": "opaque_ref"
        }
      }
    },
    {
      "name": "filesystem.read_project_metadata",
      "envelope": {
        "ok": true,
        "capability": "filesystem.read_project_metadata",
        "result": {
          "project": {
            "name": "lobster-buffet",
            "kind": "software",
            "lifecycle_state": "active",
            "privacy": "public-candidate"
          },
          "backlog": {
            "open_next": 1,
            "open_later": 7,
            "done": 12
          },
          "metadata_refs": [
            "BACKLOG.md",
            "docs/GOAL.md",
            "docs/PRODUCT_BRIEF.md"
          ]
        },
        "warnings": [],
        "private_data": {
          "contains_private_values": false,
          "private_refs_only": true,
          "disclosure_policy": "redacted_summary"
        }
      }
    },
    {
      "name": "git.inspect_status",
      "envelope": {
        "ok": true,
        "capability": "git.inspect_status",
        "result": {
          "repo": {
            "is_git_repo": true,
            "branch": "main",
            "dirty": false,
            "ahead": 0,
            "behind": 0
          },
          "worktree": {
            "changed_count": 0,
            "untracked_count": 0
          },
          "remote": {
            "has_remote": true,
            "remote_ref": "origin"
          }
        },
        "warnings": [],
        "private_data": {
          "contains_private_values": false,
          "private_refs_only": true,
          "disclosure_policy": "redacted_summary"
        }
      }
    },
    {
      "name": "incident.read_state",
      "envelope": {
        "ok": true,
        "capability": "incident.read_state",
        "result": {
          "incidents": [
            {
              "id": "incident-001",
              "status": "active",
              "severity": "medium",
              "title": "Example active incident",
              "updated_at": "2026-07-09T00:00:00Z",
              "resurface": false
            },
            {
              "id": "incident-002",
              "status": "stale",
              "severity": "high",
              "title": "Example stale incident",
              "updated_at": "2026-07-07T00:00:00Z",
              "resurface": true
            },
            {
              "id": "incident-003",
              "status": "closed",
              "severity": "low",
              "title": "Example closed incident",
              "updated_at": "2026-07-08T00:00:00Z",
              "resurface": false
            }
          ]
        },
        "warnings": [],
        "private_data": {
          "contains_private_values": false,
          "private_refs_only": true,
          "disclosure_policy": "redacted_summary"
        }
      }
    }
  ]
}
